{
  "$schema": "https://json-schema.org/draft/2020-12/schema",
  "title": "Risk",
  "type": "object",
  "additionalProperties": false,
  "properties": {
    "id": {
      "type": "string"
    },
    "tenant_id": {
      "type": "string"
    },
    "title": {
      "type": "string"
    },
    "description": {
      "type": "string"
    },
    "impact": {
      "type": "string",
      "enum": [
        "low",
        "medium",
        "high",
        "critical"
      ]
    },
    "likelihood": {
      "type": "string",
      "enum": [
        "rare",
        "unlikely",
        "possible",
        "likely",
        "low",
        "medium",
        "high"
      ]
    },
    "status": {
      "type": "string",
      "enum": [
        "open",
        "mitigated",
        "mitigating",
        "closed"
      ]
    },
    "owner": {
      "type": "string"
    },
    "classification": {
      "type": "string",
      "enum": [
        "public",
        "internal",
        "confidential",
        "restricted"
      ]
    },
    "project_id": {
      "type": "string"
    },
    "mitigation": {
      "type": "string"
    },
    "created_at": {
      "type": "string",
      "format": "date-time"
    },
    "updated_at": {
      "type": "string",
      "format": "date-time"
    }
  },
  "required": [
    "id",
    "tenant_id",
    "title",
    "impact",
    "likelihood",
    "status",
    "owner",
    "classification",
    "created_at"
  ],
  "x-schema-metadata": {
    "name": "risk",
    "version": "1.0.0",
    "compatibility_mode": "full"
  }
}
