{
  "id": "risk-001",
  "tenant_id": "tenant-alpha",
  "title": "Vendor dependency",
  "description": "Single vendor dependency may delay rollout.",
  "impact": "high",
  "likelihood": "possible",
  "status": "open",
  "owner": "risk@ppm.example",
  "classification": "confidential",
  "created_at": "2026-02-20T11:00:00Z",
  "updated_at": "2026-03-05T12:00:00Z"
}
